id,heading,information,icon
7,Copyright Registration Services From Leading Experts,Right of ReproductionRight of Reproduction Right of AdaptationRight of Adaptation Right of Communication To The PublicRight of Communication To The Public Right of Public PerformanceRight of Public Performance Right of Paternity And IntegrityRight of Paternity And Integrity Right of DistributionRight of Distribution,base/images/copyright_zBVsz4g.png
5,TDS Return Filing Services From Leading Experts,Form 24QForm 24Q Form 26QForm 26Q Form 27QForm 27Q Form 27EQForm 27EQ,base/images/tds.png
4,ITR Filing Services From Leading Experts,ITR-1 (Sahaj)ITR-1 (Sahaj) ITR-2ITR-2 ITR-3ITR-3 ITR-4 (Sugam)ITR-4 (Sugam) ITR-5ITR-5 ITR-6ITR-6 ITR-7ITR-7,base/images/itr-1.png
3,Trademark Registration Services From Leading Experts,The Vienna Codification ProcessThe Vienna Codification Process The Examination Of TrademarkThe Examination Of Trademark Hearing Before Trademark Register/officerHearing Before Trademark Register/officer Trademark SearchTrademark Search Class SelectionClass Selection Preparing The ApplicationPreparing The Application A Great Business OpportunityA Great Business Opportunity A Legal ProtectionA Legal Protection Global Filing Of TrademarkGlobal Filing Of Trademark,base/images/tm.png
2,GST Return Filing Services From Leading Experts,Documents GST RET 1 (Normal)GST RET 1 (Normal) GST RET 2 (Sahaj)GST RET 2 (Sahaj) GST RET 3 (Sugam)GST RET 3 (Sugam) GST ANX-1GST ANX-1 GST ANX-2GST ANX-2 GST PMT-08GST PMT-08,base/images/gst.png
1,Private Limited Company Services From Leading Experts,Two DirectorsTwo Directors Unique NameUnique Name Minimum Capital ContributionMinimum Capital Contri,base/images/pvt-ltd.png
